book_id,title,category_id,year,author,publisher
404,The Hope of little Austin Osborne,2,1983,Tina Olson,East Jason
405,The Beauty in Michaelshire,3,2007,Katherine Pope,Monicashire
406,The life of Meghan Rush,4,2020,Laura Anderson,Stephanieshire
407,The Affair at North Anthony,5,2007,Emily Cabrera,Maryfort
408,The Hope of little Joseph Mcintyre,6,2013,Kathleen Padilla,Brownmouth
409,The Beauty in West Kimberlymouth,1,1974,Gail Gregory,Katherinefurt
410,The life of Donna Hendricks DDS,2,2002,Laura Ramos,Carterberg
411,The Affair at Jennaside,3,1979,John Landry,New Debrashire
412,The Hope of little Stephanie York,4,2002,Marie Hill,Richardsonville
413,The Beauty in Port Michael,5,1992,Ariana Brown,South Lisa
414,The life of Curtis Taylor,6,1993,Carl Harris,North Anna
415,I am not Snow,1,2006,Yesenia Obrien,Lake Corey
416,The Affair at West Raymondfort,2,1997,Carla Bryant,Ericaberg
417,The Hope of little Patricia Morrow,3,1997,Larry Jones,New Danielside
418,The Beauty in East Teresaland,4,1984,Sheri Chapman,Davisstad
419,The life of Joseph Anderson,5,1989,Jose Moore,East Nicholas
420,I am not Gainsboro,6,1992,Angie Torres,Meganland
421,The Affair at West Sarah,1,2005,Megan Patel,South Alexanderborough
422,The Hope of little Travis Stone,2,1977,Casey Gomez,South Tylerburgh
423,The Beauty in Meghanview,3,1992,Tina Robertson,South Patriciafort
424,The life of Krista Martinez,4,1999,John Moore,Jeremyfurt
425,The Affair at Meganshire,5,1980,Andrew Foster,Rachelburgh
426,The Hope of little Scott Miller,6,1981,Brian Smith,West Vincent
427,The Beauty in Debrashire,1,1984,Randall Lin,Lake Lori
428,The life of Amanda Small,2,1975,Corey Thomas,New Jameston
429,The Affair at East Scottfort,3,1995,Danielle Jacobson,North Aaron
430,The Hope of little Gerald Thomas,4,1994,Robert Paul,Johnview
431,The Beauty in Jessicastad,5,2012,Nicholas Mayo,New Jennifer
432,The life of Jacob Hoffman,6,2006,Kathy Johnson,Heatherberg
433,The Affair at Wrightburgh,1,2008,Jennifer Nelson,North Ernest
434,The Hope of little Taylor Griffith,2,2007,Andrew Hernandez,Saraview
435,The Beauty in Port Erik,3,1976,Alexandra Kelly,Gregorytown
436,The life of Shawn Jimenez,4,1982,Nicholas Hamilton,South Clayton
437,The Affair at Harperfort,5,1977,Jeffery Gibson,Garciahaven
438,The Hope of little Adam Rodriguez,6,1973,Ashley Fitzgerald,Melissaland
439,The Beauty in West Jessica,1,1975,Edward Hunt,Thomasbury
440,The life of Andrew Williams,2,1995,Gene Ward,North Cassandraburgh
441,The Affair at North Phillip,3,1989,Michelle Jones,Port Sarahberg
442,The Hope of little Gina Mcmillan,4,1995,Jeff Steele,Guzmanmouth
443,The Beauty in East Carrie,5,2017,Isaiah Harris,West Angelaberg
444,The life of Amber Taylor,6,1980,Michele Bennett,Lake Tammiestad
445,The Affair at Franciscoport,1,1984,Charles Rose,Theodoremouth
446,The Hope of little Katie Hicks,2,2008,Deanna Armstrong,Jennachester
447,The Beauty in Ericksonport,3,2017,Erik May,Martinstad
448,The life of Isabella Nunez,4,1985,Margaret Johnson,Christophershire
449,I am not PapayaWhip,5,2017,Erin Mosley,New Lindseyberg
450,The Affair at Lake Brett,6,2018,Victor Black,Sethberg
451,The Hope of little Mr. Nathan Hampton,1,1979,Brenda Harrell,South Clintonmouth
452,The Beauty in Hernandezbury,2,1980,Katherine Cox,Richardberg
453,The life of Melody Lee,3,1982,Donna Moore,Nashbury
454,I am not Purple,4,1985,Austin Peterson,Lewisfort
455,The Affair at New Jared,5,1986,Sean Cisneros,Nelsonburgh
456,The Hope of little Matthew Fox,6,1992,Gregory Barnes,Nicholsburgh
457,The Beauty in Suemouth,1,1973,Jimmy Hernandez,Danielchester
458,The Fall of Ohio,2,1995,Corey Frazier,West Lisatown
459,The life of Hector Ingram,3,1980,Judy Brooks,New Ryan
460,I am not LightGray,4,2020,Tammy Garcia,Gordonton
461,The Affair at Stewartstad,5,1973,Rachael Romero,Nicholeview
462,The Beauty in Davidside,6,1988,Jenna Jensen,Pooleshire
463,The life of Jennifer Reed,1,2013,Sara Moore,Jamesland
464,I am not DarkViolet,2,1992,Ryan Barber,Townsendton
465,The Affair at East Maria,3,2004,Susan Clark,South Laurachester
466,The Hope of little Justin Nelson,4,1980,Wendy Webb,East Aimeeview
467,The Beauty in New Joycebury,5,1990,Curtis Davis,Stuartfort
468,The life of Taylor Perez,6,2019,Stephen Henderson DDS,Cindyfurt
469,I am not Lavender,1,1995,Brian Lamb,Gibbsstad
470,The Affair at South Denise,2,1997,Daniel Robinson,Jenniferland
471,The Hope of little Karen Santos,3,1988,Dominique Schneider,South Justinfurt
472,The Beauty in Manuelton,4,2004,Jennifer Horton,Snyderville
473,The Fall of Wyoming,5,2007,Taylor Parrish MD,North Brandonport
474,The life of Kenneth Nichols,6,2013,Bryan Rose,Stanleyview
475,I am not Blue,1,2004,Adam Robinson,Lopezville
476,The Affair at Lake Suzanne,2,2001,Kayla Deleon,North Joshua
477,The Hope of little Sherri Smith,3,1995,Timothy Miller,Lewisfurt
478,The Beauty in West Justinside,4,2011,Jeffrey Maldonado DDS,East Dariuston
479,The Fall of North Dakota,5,1983,Hannah Roberts,Jessicaville
480,The life of Todd Rosales MD,6,2015,Geoffrey Thompson,Nicoleburgh
481,The Affair at Ashleyborough,1,1979,Robert Rogers,Navarroside
482,The Hope of little Scott Prince,2,1999,Mary Thomas,Johnsonshire
483,The Beauty in Robertsonland,3,1994,Jason Mcknight,Jamesshire
484,The life of Cathy Taylor,4,1991,Mary Torres,Calvinport
485,The Affair at West Desireebury,5,2015,Kristina Mckay,Douglasborough
486,The Hope of little Bryan Parker,6,1992,Carrie Graham,Lindaberg
487,The Beauty in Parksport,1,2016,Julie Patterson,Alimouth
488,The life of Thomas Phillips,2,1998,Michael Ford,Combsland
489,I am not Indigo,3,2017,Charles Yang,Taylorberg
490,The Affair at Toddborough,4,2001,Timothy Evans,Mcgrathbury
491,The Hope of little Melanie Larson,5,1991,Brett Chapman,Elizabethfurt
492,The Beauty in New Seanstad,6,1975,Heather Taylor,Hillburgh
493,The Fall of California,1,1990,Mary Mclean,Port Deannafurt
494,The life of Ashley Poole,2,1977,Samuel Moore,Lake Danielfort
495,The Affair at Davishaven,3,2001,Lisa Pittman,West Daniel
496,The Hope of little Anthony Anderson,4,2013,Anne Johnson,North Michael
497,The Beauty in Bryantton,5,1977,Mario Sawyer,East Kimberlyport
498,The life of Robert Cummings,6,1977,Dana Holmes,Reginaldton
499,The Affair at North Valeriefort,1,1988,Robert Elliott DDS,West Tinachester
500,The Hope of little Jason Mack,2,1976,Richard Gonzalez,Flemingtown
501,The Beauty in Brooksfurt,3,1988,Kevin Perez,Port Alexisbury
502,The life of Susan Bennett,4,2007,Michael Li,South Jennifer
503,The Affair at Port Andrewport,5,1990,Thomas Skinner,West Judy
504,The Hope of little Nathan Coleman,6,1992,Angela Ramirez,Simpsonfurt
505,The Beauty in Morrowbury,1,1989,Leslie Todd,Jessicachester
506,The life of Donald Pineda,2,1983,Julie Riddle,East Rebecca
507,I am not DarkOliveGreen,3,1980,Matthew Huff,South Steven
508,The Affair at South Carlaton,4,2001,Ralph Hill,Martinezburgh
509,The Hope of little Andrew Gonzales,5,1989,Ryan Atkinson,New Jimmyville
510,The Beauty in Port Michelle,6,1999,Jade Dunlap,Christyburgh
511,The life of Wyatt Young,1,2015,Jane Cuevas,North Susanbury
512,The Affair at South Kevin,2,1994,Randall Cox,Edwardsville
513,The Hope of little Travis Hobbs,3,2007,Terry Craig,New Jorge
514,The Beauty in Lake Erika,4,2008,Julie Garcia,Port Ryanburgh
515,The life of William David DDS,5,2010,Ashley Bowen,Lake Samanthamouth
516,I am not Violet,6,2016,Jamie Gonzales,Shirleyville
517,The Affair at Port Jeremiah,1,2000,Laura Gilbert,West Justinville
518,The Hope of little Brianna Ford,2,1983,Steven Moyer,North Tracy
519,The Beauty in New Robertchester,3,2004,Sean Kaiser,West Lindabury
520,The life of Jasmine Scott,4,2008,Sherry Johnson,East Derrickfurt
521,I am not MediumPurple,5,1973,John Carr,North Robert
522,The Affair at Port Charlesshire,6,2007,Mr. Brian Ibarra,Robertmouth
523,The Hope of little Kristin Mendoza,1,2016,Earl Romero,Brownmouth
524,The Beauty in Kevintown,2,2009,Kimberly Chan,New Cherylberg
525,The life of Tonya Wilson,3,2018,Robert Lozano,Robertside
526,The Affair at Oscarside,4,1975,Caleb Bowers,Andersonview
527,The Hope of little Elizabeth Ward,5,2000,Allison Hill,North Joseph
528,The Beauty in Owensfort,6,1996,Michelle Chavez,South Kelliemouth
529,The life of Suzanne Wood,1,2006,Lacey Hall,Kingport
530,The Affair at Phillipsborough,2,2002,Kayla Trevino,North Ronaldland
531,The Hope of little James Whitaker,3,2004,Shane Barnes,West Davidport
532,The Beauty in Piercemouth,4,1994,Michelle Phelps,East Alice
533,The Fall of Kentucky,5,2011,Gregory Hansen,West Courtney
534,The life of Katherine Cummings,6,1979,Diana Baker,East Laurashire
535,The Affair at New Arthurland,1,2003,Erica Huang,East Williammouth
536,The Hope of little Mary Duran,2,1978,Sarah Moses,Jenniferchester
537,The Beauty in Taylorbury,3,1997,Timothy Cowan,South Michael
538,The life of Alexa Wagner,4,1990,Tricia Morrow,Osbornmouth
539,The Affair at New Andreatown,5,2013,Emily Hodge,Tonyaborough
540,The Hope of little Nathan Nichols,6,1982,Angela Ramos,Charlottehaven
541,The Beauty in Andrechester,1,2019,Evan Sims,Port Garytown
542,The life of Brent Hernandez,2,1981,Jennifer Conley,Nicoleburgh
543,The Affair at Cunninghambury,3,1982,Christine Park,Debbieport
544,The Hope of little Ronald Miller,4,2003,Kevin Watson,Barrettton
545,The Beauty in North Richardfurt,5,1974,Luis Watkins,Simonfort
546,The life of Mark Warner,6,2010,Jose Nielsen,New Karen
547,I am not DarkBlue,1,1992,Cody Hodge,Davisbury
548,The Affair at Port Heather,2,2018,Thomas Hughes,Kathrynberg
549,The Hope of little Denise Glass,3,1988,Gerald Morrow,Melendezbury
550,The Beauty in Rachelshire,4,1984,Michael Flowers,Drakestad
551,The life of Timothy Edwards,5,2011,Susan Shaw,Josephside
552,I am not HoneyDew,6,2000,Douglas Martinez,Stevenston
553,The Affair at Rhodesside,1,1995,Kim Foster,North Amanda
554,The Hope of little Perry Taylor,2,1996,Lee Cummings,South Williamland
555,The Beauty in New Juliestad,3,2012,Sarah Sanchez,West Ashleyborough
556,The life of David Jones,4,1990,Kyle Daugherty,Coltonbury
557,The Affair at Reynoldsshire,5,1993,Jeremy Murray,Clarkburgh
558,The Hope of little Angelica Montgomery,6,1993,John Moore,New Michael
559,The Beauty in Lake Charles,1,1986,Brian Roberts,Port Kimberly
560,The life of Michael Walters,2,2005,Jenna Trevino,Shermanport
561,I am not Orange,3,2013,Danny Lynch,New Ashleychester
562,The Affair at East Christopherchester,4,1996,Cynthia Kennedy,West David
563,The Hope of little Justin Russell,5,1983,Nathan Jones,Lake Ericahaven
564,The Beauty in North Michaelland,6,1998,Molly Williams,Moranhaven
565,The life of Erika Cruz,1,1989,Martin Jones,Goodwinview
566,The Affair at Jacksonview,2,2018,Tony Moore,Thomasmouth
567,The Hope of little Johnny Brown,3,2020,Kellie Woods,West Dawn
568,The Beauty in Hillport,4,1987,Lee Daniel,Lake Jamesfort
569,The life of Heather Raymond,5,1977,Tyrone Bradford,Port Brianshire
570,The Affair at Scottchester,6,1978,Morgan Lowery,New Kevin
571,The Hope of little Shannon Mccann,1,2007,Linda Evans,New Russellville
572,The Beauty in West Malik,2,2014,Sean Wright,Ericahaven
573,The life of Ernest Oconnell,3,2001,Michael Carson,Port Daniel
574,The Affair at Diazshire,4,1983,Lisa Moore,Valdezchester
575,The Hope of little Zachary White,5,1999,Todd Brown,Gomezberg
576,The Beauty in Lake Stevenborough,6,1986,Jessica Hill,East Ethanfort
577,The life of Sandra Jones,1,1996,Duane Ruiz,West Tiffanychester
578,I am not PaleTurquoise,2,1981,Andrea Hartman,Susanstad
579,The Affair at Fergusonchester,3,2000,John Williams,New Nathanielshire
580,The Hope of little Rachel Ward,4,2007,Jose York,Bishopborough
581,The Beauty in North Kaylastad,5,1974,Edward Hanson,Smithbury
582,The life of Amanda Terrell,6,1985,Christine White,New Carolynton
583,I am not PaleGoldenRod,1,1981,Terry Martinez,Johnsonborough
584,The Affair at South Neil,2,2004,Heather Cowan,Leeland
585,The Hope of little Michael Vaughn,3,1987,Mrs. Maria Price DDS,Jessicamouth
586,The Beauty in West Whitney,4,2012,Christopher Thompson,Lake Lisa
587,The life of Jason Nixon,5,2003,Shane Mcintyre,New Nicholashaven
588,The Affair at Davismouth,6,1992,Steven Scott,Dianastad
589,The Hope of little Eric Patrick,1,1988,Cody Hopkins,Jennifermouth
590,The Beauty in North Melindaville,2,2013,Robert Martin,Alexanderfort
591,The life of Tara Yang,3,1994,Steven Scott,Ingrammouth
592,I am not Tomato,4,1995,Jeffrey Joyce,Port Teresaburgh
593,The Affair at East Danielle,5,1976,Heidi Hall,West Erik
594,The Hope of little Allen Mendez,6,1991,Joseph Fisher,Mcdonaldberg
595,The Beauty in South Brittany,1,1998,Maria Myers,East Mary
596,The life of Daniel Ramirez,2,1992,Patricia George,Lake Samuel
597,I am not Coral,3,2010,Michael Glenn,Blakebury
598,The Affair at Emilyfort,4,2013,Jennifer Huff,Christopherville
599,The Hope of little Margaret Harper,5,2011,Ryan Day,New Codybury
600,The Beauty in Matthewsstad,6,2015,Cindy White,Coreychester
