book_id,title,category_id,year,author,publisher
1,The Affair at North Judithbury,1,2018,Kimberly Robinson,Lisatown
2,The Hope of little Noah Rhodes,2,1980,Jamie Arnold,Barbaraland
3,The Beauty in New Roberttown,3,2011,Kimberly Sanchez,Grayside
4,The Fall of Colorado,4,2014,Dr. Marvin Thomas Jr.,Juliechester
5,The life of Jonathan Johnson,5,1989,Shannon Smith,Lake Nicoleview
6,I am not Gray,6,2011,James Martin,New Mariotown
7,The Affair at Lake Roberto,1,1989,Lisa Brandt,Lake Larry
8,The Hope of little Daniel Gallagher,2,1975,Andrea Young,Lewisberg
9,The Beauty in North Noahstad,3,1976,Gerald Hensley,East James
10,The Fall of Minnesota,4,1988,John Lewis,Barreraburgh
11,The life of Renee Blair,5,2010,Amy Edwards,New Thomashaven
12,I am not WhiteSmoke,6,2015,Kelly Donovan,Lake Jennifer
13,The Affair at Lake Jeremyport,1,1977,Jaclyn Moore,Cherylhaven
14,The Hope of little Dr. Sharon James,2,1986,Sarah Wagner,Rebeccaton
15,The Beauty in Reidstad,3,2007,Jacob Tran,Andersonport
16,The Fall of Hawaii,4,1984,Allison Doyle,Kimberlychester
17,The life of Daniel Adams,5,2015,Garrett Lin,Michaelhaven
18,I am not Cornsilk,6,2000,Kayla Cruz,West Bradley
19,The Affair at Lake Mark,1,2019,Katie Estrada,Richardport
20,The Hope of little Amy Underwood,2,2002,Michael Dixon,Lake Christopher
21,The Beauty in Richardland,3,2018,Kathleen Sanchez,Port Michelleville
22,The Fall of Indiana,4,2012,Stephanie Simmons,Merrittfort
23,The life of Latoya Robbins,5,2007,Chris Reyes,Lake Jason
24,I am not HotPink,6,1973,Elizabeth Price,Medinaside
25,The Affair at Coxberg,1,1978,Brandy Murray,West Nicholasborough
26,The Hope of little Ann Williams,2,1988,Alex Hernandez,South Elizabeth
27,The Beauty in East Courtneychester,3,1998,Christina Vargas,North Heidi
28,The Fall of Rhode Island,4,1979,Jack Snow,Zimmermanchester
29,The life of James Ferrell,5,2001,John Bishop,Rogersfort
30,I am not Wheat,6,2017,Michael West,North Kellyfurt
31,The Affair at Danielchester,1,1980,Tiffany Vaughn,East Joanna
32,The Hope of little Aaron Bowen,2,2008,Tony Little,Garciatown
33,The Beauty in Teresaburgh,3,1978,Bailey Duran DDS,Port Alexandra
34,The Fall of North Carolina,4,1988,Benjamin Smith,Norrisfort
35,The life of Sheila Evans,5,2007,Chase Baker,North Brian
36,I am not Tan,6,2020,David Davis,Port Emilyview
37,The Affair at West Natashaport,1,1983,Michael Roberts,Cervantesside
38,The Hope of little David Bradley,2,2013,Anthony Adams,West Samuel
39,The Beauty in North Jessicaland,3,2005,Jennifer Olson,Sanchezside
40,The Fall of Wisconsin,4,2019,Kevin Duarte,Grimesmouth
41,The life of Beth Keller,5,2018,Jane Mcneil,South Tammie
42,I am not FireBrick,6,2003,Deborah Hanson,Santosmouth
43,The Affair at Samuelhaven,1,2001,Elijah Johnson,Lauraport
44,The Hope of little David Brown,2,1987,David Scott,Port Stevenport
45,The Beauty in New Angelashire,3,1997,Laura Haney,Andrewfurt
46,The Fall of Iowa,4,2016,Patricia Becker,Lake Colton
47,The life of Michael Brown,5,2006,Denise Martin,Coffeyport
48,I am not CornflowerBlue,6,2002,Paul Baker,Carsonstad
49,The Affair at Sanchezfort,1,1975,Elizabeth Vasquez,East Paigeberg
50,The Hope of little Cheryl Davis,2,1986,Trevor Foley,Lake Michaelstad
51,The Beauty in Gomezchester,3,1977,Kristen Willis,West Kim
52,The Fall of New Jersey,4,2006,Arthur West,Williamville
53,The life of Amy Valdez,5,1977,Erica Hernandez,West Claudia
54,I am not DarkGreen,6,1994,Jennifer Blair,Ronaldview
55,The Affair at Taylorburgh,1,1999,Maurice Christensen,West Carolinestad
56,The Hope of little David Leblanc,2,2011,Sandra Adams,West Jacqueline
57,The Beauty in Mortonside,3,1983,Nathan Frank,North Ericton
58,The Fall of Connecticut,4,1987,Kyle Smith,Sierraberg
59,The life of Zachary Huff,5,2020,Albert Morse,Barbarashire
60,I am not DarkGoldenRod,6,1988,James Miller,Juliebury
61,The Affair at Smithfurt,1,2014,Trevor Burton,Webstershire
62,The Hope of little Richard Gibson,2,1995,Emily Hayes,West Marieland
63,The Beauty in Hortonside,3,2001,Steven Cooper,New Debbieton
64,The Fall of Texas,4,1977,Justin Hughes,Jenniferberg
65,The life of Brittney Phillips,5,2015,Theresa Osborn,Lake Ellenhaven
66,I am not Chartreuse,6,2020,Amanda Rogers,New Nicholas
67,The Affair at North Susan,1,1987,Emily Stokes,Mckeeborough
68,The Hope of little Cody Larson,2,2008,Michelle Black,West Christopherburgh
69,The Beauty in South David,3,1988,Brad Walker,Sarahmouth
70,The Fall of Oregon,4,2000,Dwayne Turner,East Robertmouth
71,The life of Kristopher Harvey,5,2015,Kelly Ward,South Morganton
72,I am not PeachPuff,6,1995,Robin Thompson,Pollardfort
73,The Affair at West Randy,1,2003,Paul Lee,Michelleton
74,The Hope of little Elizabeth Stewart,2,1978,Angela Morrison,New Kelly
75,The Beauty in North Stephenshire,3,2013,Theresa Jones,Coxburgh
76,The life of Daniel Baker,4,2001,Laura Moreno,Edwardsview
77,I am not MediumVioletRed,5,1981,Jodi Roach,Osbornmouth
78,The Affair at Lake Lisaport,6,1974,Kenneth Mcdonald,New Nicole
79,The Hope of little Ashley Humphrey,1,1981,Thomas Brown,New Ericburgh
80,The Beauty in Darrellville,2,2012,Kathryn Jackson,East Donna
81,The Fall of West Virginia,3,1991,Elizabeth Sanchez,Evansland
82,The life of Denise Jacobs,4,1988,Derek Wright,North Kellyfurt
83,I am not MediumSpringGreen,5,1998,Tracy Lewis,Brandonport
84,The Affair at Lake Rodneyview,6,1996,Angel Gordon,Marciaville
85,The Hope of little Gavin Anderson,1,2003,Brittany Barry,West Sarah
86,The Beauty in Evanmouth,2,2010,Steven Wiggins,New Thomasshire
87,The Fall of Oklahoma,3,1993,Jason Harris,Salaston
88,The life of Kristina Rodriguez,4,2012,Dr. Douglas Evans,Kellieborough
89,I am not DeepPink,5,1991,Tyler Miller,Douglasfort
90,The Affair at Rachelton,6,1976,Gary Kennedy,North Tamara
91,The Hope of little Christine Wright,1,1984,Ryan Peck,Port Randyfort
92,The Beauty in West Kimberlychester,2,1980,Nicholas Wong,North Jill
93,The Fall of South Carolina,3,1988,James Griffin,Stephanieport
94,The life of Tammy Young,4,1987,Karen Gibson,Robertside
95,I am not DodgerBlue,5,1985,Brittany Murphy,Wilsonborough
96,The Affair at West Erik,6,1989,Nichole Lane,South Melvinland
97,The Hope of little Janet Williams,1,1981,Hannah White,Ricebury
98,The Beauty in Walkermouth,2,1975,Jennifer Miranda,East Jamieville
99,The life of Robert Perez,3,2009,Megan Flores,Nancyhaven
100,I am not Bisque,4,1993,Jennifer Evans,Port Amanda
101,The Affair at Frazierside,5,2014,Jerry Watson,North Joseph
102,The Hope of little Alexander Wiley,6,1988,Michele Sanders,New Marc
103,The Beauty in Gregoryview,1,1975,Connie Thomas,Angelashire
104,The Fall of Arizona,2,2002,Robert Jackson,Whiteside
105,The life of Jeffrey Chandler,3,1976,Mary Jensen,Hopkinstown
106,I am not Maroon,4,2012,Robin Adams,Millerfurt
107,The Affair at Smithside,5,2004,Maria Rivera,New Samanthabury
108,The Hope of little Teresa Mclaughlin,6,2010,Robert Nicholson,West Franciscobury
109,The Beauty in West Ryan,1,1993,Donald Riddle,Perezside
110,The life of Lisa Alvarado,2,1993,Brandon Hahn,Wardview
111,I am not DarkRed,3,1999,Bradley Santana,New Adriana
112,The Affair at East Robert,4,2011,Judith Taylor,South Martinfurt
113,The Hope of little Megan Orr,5,1991,Mackenzie Faulkner,West Nicholas
114,The Beauty in Richardtown,6,2016,Mr. David Hopkins DDS,Jonesfort
115,The Fall of Maryland,1,1994,Jessica Smith,Jeffreyhaven
116,The life of Jeffrey Carpenter,2,2019,Eric Gibson,New Timothy
117,I am not MediumBlue,3,1984,Erin Simmons,Hallfurt
118,The Affair at Clarencebury,4,2009,Shane Lopez,Jamesville
119,The Hope of little Courtney Gonzalez,5,2012,Megan Edwards,West Daryl
120,The Beauty in North Johnfort,6,2004,Cody Wilkinson,Port Michaeltown
121,The life of Angel Perry,1,1991,Danny Roberts,Cunninghamfort
122,I am not GoldenRod,2,1975,Gregory Montoya,Grimesville
123,The Affair at Robinsonhaven,3,1990,Caroline Werner,Keithview
124,The Hope of little Justin Lowery,4,2004,Mark Burton,Hayesland
125,The Beauty in South Dennismouth,5,1977,Jennifer Donaldson,South Joseph
126,The life of Kristin Stewart,6,2000,Michael Anderson,Erikview
127,I am not Red,1,1977,Darrell Frazier,North Heatherville
128,The Affair at Greenbury,2,1977,Alejandra Santos,Bellborough
129,The Hope of little Destiny Strickland,3,1988,Bradley Tran,Kimberlytown
130,The Beauty in Simsview,4,1981,Ryan Fisher,Port Thomas
131,The Fall of New Hampshire,5,2007,Diamond Collins,Port Eric
132,The life of Dustin Nelson,6,1980,Chad Smith,Bentonhaven
133,I am not MediumAquaMarine,1,2004,Ian Porter,West Eric
134,The Affair at Russellside,2,2008,Michelle Rios,West John
135,The Hope of little Antonio Wall,3,1992,Juan Smith,West Anne
136,The Beauty in Steinshire,4,1987,Makayla Steele,West Aaronfurt
137,The Fall of Vermont,5,2002,Angela Davis,Lake Lori
138,The life of Spencer Johnston,6,1977,Brandy Carrillo,East Danielmouth
139,I am not Silver,1,1986,Erin Davis,West Randy
140,The Affair at South Jeffrey,2,1981,James Parks,New Brendaland
141,The Hope of little Allen Rogers,3,2004,Michael Thompson,East Joshua
142,The Beauty in Ramseymouth,4,2014,Kelly Mccoy,South Kimberlystad
143,The Fall of Florida,5,2003,Pamela Key,North John
144,The life of Ms. Susan Vargas,6,1988,Renee Wolfe,Lake Jackieshire
145,The Affair at Murphyfurt,1,1973,Lucas Drake,Jennifermouth
146,The Hope of little Trevor Fisher,2,2019,Rebecca Yu,Grantside
147,The Beauty in South Andrewside,3,1984,Tammy Ponce,Lake Ariana
148,The Fall of Arkansas,4,1989,Michelle Williams,Oconnorburgh
149,The life of Mrs. Marie Harrington DDS,5,1994,James Dennis,West Brookefort
150,I am not Black,6,2015,David Williams,Hernandezstad
151,The Affair at South Holly,1,1978,Jasmine Watson,Woodmouth
152,The Hope of little Carol Lawson,2,2006,Joseph Camacho,Armstrongbury
153,The Beauty in Port Loriport,3,1981,Blake Vega,Port Courtney
154,The life of Tanya Johnston,4,1982,Kevin Chang,North Annaville
155,I am not OldLace,5,1998,Erin Young,Mccallstad
156,The Affair at Melissaville,6,2011,Chelsea Lewis,Figueroahaven
157,The Hope of little Kylie Williams,1,1988,Anthony Ward,West Micheal
158,The Beauty in Stanleyland,2,2020,Ann Johnson,East Melissaborough
159,The life of Alexandria Fisher,3,2018,Maria Coleman,Yorkmouth
160,I am not SlateGray,4,2003,William Davidson,Joseport
161,The Affair at Lake Aimee,5,1998,Andrew Erickson,West Jessica
162,The Hope of little Lisa Gillespie,6,2016,Martha Walker,Lake Monica
163,The Beauty in Marshallshire,1,1980,Jane Evans,Port Melissaberg
164,The Fall of Louisiana,2,2013,Jesse Clark,New Kathy
165,The life of David Michael,3,1993,Kiara Smith,Lake Jessicabury
166,I am not LightSeaGreen,4,1994,Katherine Christensen MD,Smithbury
167,The Affair at Hunterborough,5,2014,Amber Wilson,Jamesside
168,The Hope of little David Ramirez,6,2005,Autumn Wilson,South Jamesborough
169,The Beauty in Angelahaven,1,2009,Brittany Davis,Lake Jenniferview
170,The Fall of Illinois,2,1979,Stefanie Smith,Lake Deborah
171,The life of Nathan Freeman,3,2017,Rebecca Banks,North David
172,I am not LawnGreen,4,2003,Ashley Jenkins,North Josemouth
173,The Affair at West Elizabeth,5,1982,Kristin Huerta,North Dawnburgh
174,The Hope of little Juan Cooper,6,2001,Joan Gates,Stewartfort
175,The Beauty in Michaelmouth,1,1987,Evelyn Saunders,Moranstad
176,The life of David Griffith,2,1979,Craig Martinez,Lewisborough
177,The Affair at Jennyhaven,3,2006,Kristen Reynolds,Glassburgh
178,The Hope of little Veronica Wall,4,1998,Tracy Chavez,East Robert
179,The Beauty in Jeremyburgh,5,2005,Mallory Page,Annashire
180,The life of Joseph Hill,6,2016,Ryan Vaughn,Jamesside
181,I am not CadetBlue,1,2017,Tammy Hughes,Tammyton
182,The Affair at Taylormouth,2,2001,Michael Lopez,Lake Willie
183,The Hope of little Vincent King,3,2013,Mary Henry,Charlesmouth
184,The Beauty in Wilsonland,4,2003,Samantha Zavala MD,Seanbury
185,The Fall of Montana,5,1991,Cheryl Palmer,East Teresaside
186,The life of Kenneth Parks Jr.,6,1978,Christopher King,New Lorraineview
187,I am not LimeGreen,1,2005,Richard Turner,West Kathymouth
188,The Affair at Kerrport,2,1973,Kristen Martinez,New Candiceside
189,The Hope of little Wanda Torres,3,2008,Joshua Roberts,West Coreyshire
190,The Beauty in New Susanville,4,1993,Caroline Edwards,Lake Jodi
191,The life of Daniel Guerrero,5,1981,Christina Gross,Lake Charlestown
192,I am not DimGray,6,1981,Jordan Sanders,Lake Johnburgh
193,The Affair at Antonioport,1,1996,Michael Holmes,Paulmouth
194,The Hope of little Michele Gibson,2,2010,Sara Black,Kaufmanbury
195,The Beauty in West Kristin,3,1996,Ruth Guerrero,Shepherdville
196,The Fall of South Dakota,4,1976,Thomas Black,Greeneshire
197,The life of Regina Gonzalez,5,2012,Deborah Ramsey,Sandrashire
198,I am not DarkOrange,6,2005,Anna Hopkins,Port Erikachester
199,The Affair at Brookeshire,1,2000,John Hall,West Carmenside
200,The Hope of little Jessica Harrison,2,2014,Deborah Herrera,Cherylfurt
201,The Beauty in Hollyview,3,2020,Richard Avery,East Williammouth
202,The life of Jessica George,4,2012,Donna Stuart,Port Lorifort
203,I am not Plum,5,1990,Heather Foster,New Alexis
204,The Affair at Port Katelynfort,6,2005,Benjamin Phillips,Port Williamview
205,The Hope of little Jessica Ramirez,1,2016,Rebecca Gutierrez,Zacharytown
206,The Beauty in Waltersfort,2,2004,Cynthia Allen,Jamieborough
207,The life of Jason Morris,3,2004,Phillip Dixon,Walkershire
208,I am not DarkKhaki,4,1973,Jamie Garcia,Chloeview
209,The Affair at South Christopherview,5,2001,Carlos Johnston,Port Cory
210,The Hope of little Wayne Powell,6,2007,Rachel Evans,South Coreyburgh
211,The Beauty in Lake Mollymouth,1,1995,Tracey Gonzalez,Port Justin
212,The Fall of Nebraska,2,1977,Greg Edwards,Jenniferfurt
213,The life of Joseph Dean,3,1986,Brian Brown,Kelleytown
214,I am not SpringGreen,4,1974,Howard Herman,Mcdonaldside
215,The Affair at Martinezbury,5,2003,Regina Ramos,Robertberg
216,The Hope of little Emily Smith,6,2011,Adam Brooks,Khanchester
217,The Beauty in Davisville,1,1990,Scott White,Danielmouth
218,The life of Maria Moore,2,1982,Daniel Fisher,Boltonmouth
219,I am not LightSteelBlue,3,1997,Jessica Rojas,East Stevenville
220,The Affair at South James,4,2015,Brian Chen,Alexisview
221,The Hope of little Nicole Taylor,5,1976,Christian Herrera,East Tonymouth
222,The Beauty in West Kendrachester,6,1985,Kimberly Morris,Hillside
223,The Fall of Michigan,1,2012,Nathan Barrett,Leefort
224,The life of Katie Hoover,2,1975,Sara Barrett,Brandonbury
225,I am not LightSkyBlue,3,2018,Luis Rice,Port Kevinborough
226,The Affair at Reedside,4,2017,Sonya Jackson,New Richard
227,The Hope of little Jamie Cantu,5,2009,Jaime Pierce,Michaelmouth
228,The Beauty in Lake John,6,2008,Laura Duncan,North Stevenberg
229,The Fall of Missouri,1,2017,Sabrina Davis,Benjaminshire
230,The life of Reginald Williams,2,2013,Janet Torres,West Amberberg
231,I am not Sienna,3,1981,John Mcgee,Bakerfurt
232,The Affair at New Tammy,4,1990,Erica Glass,North Emilychester
233,The Hope of little Brian Kirk,5,1985,Brittney Chandler,North Jodibury
234,The Beauty in New Reneetown,6,1989,Lisa Gay,South Brandyhaven
235,The Fall of Washington,1,1979,Sean Banks,South William
236,The life of Seth Booker,2,2016,Mario Young,Lisaview
237,I am not Crimson,3,1999,Christian Waller,Shaneberg
238,The Affair at Finleyfort,4,1993,Joseph Ball,West Mary
239,The Hope of little Amanda Jones,5,2011,Crystal Hall,West Christopherfort
240,The Beauty in Wendyland,6,1990,Courtney Powers,Port James
241,The Fall of Nevada,1,2006,Michele Johnson,South Stephenton
242,The life of Paige Padilla,2,2012,Melissa Mckee,Gallegosmouth
243,The Affair at Nicholasberg,3,2002,Fred Wong,Lake Jessica
244,The Hope of little Jason Maldonado,4,1983,Cassidy Joseph,Parkermouth
245,The Beauty in East Gregory,5,1986,Karen Ortiz,New Carolbury
246,The life of Lisa Allen,6,1976,Xavier Martin,Cherylshire
247,I am not DarkTurquoise,1,1981,Scott Murphy,Warrenborough
248,The Affair at North Scott,2,2012,Kelly Welch,Mortonbury
249,The Hope of little Kevin Fowler,3,1973,Melissa King,West Kevinside
250,The Beauty in Vaughnmouth,4,2014,Christopher Murray,Stevenchester
251,The life of James Webb,5,1997,Sarah Duncan,Lopezville
252,I am not LavenderBlush,6,1985,Jill Johnson,Steinberg
253,The Affair at Alanton,1,1997,Kelly Smith,Lake Melanieland
254,The Hope of little Natasha Wall,2,2015,Chase Hill,New Anitaville
255,The Beauty in Kimberlybury,3,1981,Steven Williams,Brownchester
256,The life of Colleen Lee,4,2009,Robert Gillespie,Davisport
257,I am not LightCoral,5,2003,Christopher Tate,New Dakota
258,The Affair at West Kristinaton,6,2017,Rachel Graham,Amybury
259,The Hope of little Morgan Davis,1,1977,Melissa Carlson,Murphyton
260,The Beauty in Markchester,2,2016,Elizabeth Bauer,Samanthachester
261,The Fall of Idaho,3,1980,Sharon Young,Garrettfurt
262,The life of Richard Walter,4,1973,Alan Griffith,Barrettberg
263,I am not Moccasin,5,1984,Adam Jimenez,Lake Walter
264,The Affair at Lindamouth,6,2002,Kelly Bishop,South Crystal
265,The Hope of little Brenda Levy,1,1991,Michael Harper,Jessicashire
266,The Beauty in Coffeyside,2,1981,Denise Scott,New Gregshire
267,The Fall of Mississippi,3,2004,Jennifer Reyes,Barberburgh
268,The life of James Baker,4,1987,Michael Wells,New Monica
269,The Affair at Lake Jesustown,5,1990,Dawn Silva,Mejiabury
270,The Hope of little Terri Murphy,6,1989,Alexander Davis,New Danielle
271,The Beauty in Lake Bryan,1,1990,Melissa Contreras,Jonathanland
272,The life of Elizabeth Ortiz,2,1979,Randy Robinson,South Jenniferville
273,I am not DarkSlateGray,3,2018,Katherine Graham,New Jeremiahfurt
274,The Affair at Chavezside,4,1991,Cassandra Williams,Guerreroport
275,The Hope of little Patrick Moore,5,2001,Alexis Morgan,Kristinton
276,The Beauty in Penafort,6,2012,Michael Anderson,Lake Brendan
277,The life of Trevor Johnson,1,1993,Michael Gardner,Maryborough
278,I am not NavajoWhite,2,1983,John Smith,North Jasmine
279,The Affair at South Joshuaville,3,2013,Elizabeth Barnes,East David
280,The Hope of little Samantha Davis,4,2004,Michael Williams,Justinchester
281,The Beauty in Lake Danielle,5,2010,Jennifer Burgess,Jerryville
282,The Fall of Alaska,6,1984,Chad Cortez,Theresaborough
283,The life of Gavin Zhang,1,2009,Sarah Miller,Atkinsborough
284,I am not GreenYellow,2,1999,Amanda Ruiz,South Amandafort
285,The Affair at West Micheleberg,3,1983,Shannon Burgess,South Stevenberg
286,The Hope of little Ms. Rebecca Rodriguez,4,2009,Rachel Miller,Jillton
287,The Beauty in East Alexisbury,5,1988,Mariah Mclaughlin,Port Julie
288,The Fall of Pennsylvania,6,1991,Jacob Nunez,East Patriciamouth
289,The life of Christopher Williams,1,1991,Michael Huynh,Reedmouth
290,The Affair at Gordonton,2,2008,Eric Anderson,Georgeview
291,The Hope of little Susan Hopkins,3,2018,Mary Hernandez,North Blake
292,The Beauty in Stephentown,4,1980,Jennifer Porter,South Sarah
293,The life of Dr. Jessica Rodriguez DDS,5,1994,Monique Mccullough,Lake Andrea
294,The Affair at Oscarhaven,6,2016,Anita Hunt,South Louis
295,The Hope of little Jonathan Jordan,1,2020,Regina Roberts PhD,Chandlerchester
296,The Beauty in Port Dianaside,2,1999,Joel Bradley,East Jacob
297,The life of Jessica Beasley,3,1980,Stephanie Butler,Knoxbury
298,I am not PaleVioletRed,4,1989,Anthony Flores,West Frank
299,The Affair at Stephaniefort,5,2016,Denise Wolfe,Codyshire
300,The Hope of little Ronald Davis,6,2007,Michaela Lang,Stevensland
301,The Beauty in Lake Joanneberg,1,1987,Michael Watts,Davidberg
302,The life of Tyler Hoffman,2,1992,Nicole Patton,New Rachel
303,The Affair at New Williamberg,3,2010,Kendra Baldwin,Georgeside
304,The Hope of little Courtney Rodriguez,4,2005,Brian Rollins,South Danielberg
305,The Beauty in Dannyview,5,2000,Benjamin Randall,Crosbystad
306,The life of Jeffrey Hoffman,6,1977,Curtis Gonzalez,Martinezchester
307,The Affair at Sandrastad,1,1989,David Dunlap Jr.,Port Carlostown
308,The Hope of little Sergio Knight,2,2007,Scott Payne,South Nicoleville
309,The Beauty in Jonestown,3,2009,Mary Jennings,Alvarezburgh
310,The life of Cindy Barnes,4,2013,Brent Reed,Robertton
311,The Affair at West Scottchester,5,2009,Jennifer Smith,Chapmanmouth
312,The Hope of little Mr. Donald Fischer,6,1985,Ryan Cobb PhD,West Joseph
313,The Beauty in West Russellport,1,2014,Kathy Evans,Jamesfurt
314,The Fall of Utah,2,2012,Susan Michael,New Jamesmouth
315,The life of Katelyn Estrada,3,1989,Cynthia Allen,East Anthony
316,I am not Brown,4,1974,Steven Edwards,Michellechester
317,The Affair at Keithville,5,1989,Brandon Greene DDS,Markshire
318,The Hope of little Paul Thompson,6,1993,Karen Sanchez,Natashaberg
319,The Beauty in Patelbury,1,1992,Mercedes Leach,New Michellemouth
320,The life of Mary Gomez,2,1975,Bobby Chan,Ruizchester
321,I am not Orchid,3,2013,Martin Smith,Lake Kevin
322,The Affair at Mckinneychester,4,1989,Kevin Murphy,Jameschester
323,The Hope of little Jared Burch,5,1976,Jeffrey Green,West Georgeshire
324,The Beauty in Port Stacey,6,1997,Scott Greene,Jessicaborough
325,The life of Tamara Davis,1,1993,Jennifer Lewis,Ericksonview
326,I am not DarkMagenta,2,2010,Christopher Vasquez,Natalieberg
327,The Affair at Kimberlyland,3,2012,Tammy Black,Staffordmouth
328,The Hope of little Ashley Hicks,4,2000,Steven Simpson,Kellyside
329,The Beauty in Michaelberg,5,2010,Mrs. Pamela White DVM,Port Tyler
330,The Fall of Kansas,6,2011,Erin Williams,Nguyenshire
331,The life of David Thompson,1,1978,Daniel Price,Mitchellberg
332,I am not DeepSkyBlue,2,1990,Jenny Avila,Christinachester
333,The Affair at Maldonadoshire,3,1992,Carl Leach,New Ronald
334,The Hope of little Victoria Morris,4,1980,Julie Hartman,Williamschester
335,The Beauty in Edwardland,5,2000,Abigail Wilson,Lake Thomas
336,The Fall of New Mexico,6,1974,Matthew Santos,Wilkinsonside
337,The life of Eric Hill,1,1985,Ronald Myers,Alanchester
338,The Affair at New Brookefurt,2,1987,Kelsey Henderson,Angelaview
339,The Hope of little Julian Conner,3,2011,Michelle Mcdonald,Jenniferfurt
340,The Beauty in South Reginashire,4,1979,Terri Snyder,East Angela
341,The Fall of Tennessee,5,1994,Patricia Carrillo,Paulahaven
342,The life of Larry Mason,6,1996,Edgar Alexander,Oconnorville
343,I am not Chocolate,1,1978,Mike Perry,East Karen
344,The Affair at Lake Samuel,2,2018,Terri Miller,Richardburgh
345,The Hope of little Joseph Moore,3,2019,Susan Smith,Rachelberg
346,The Beauty in Samanthafurt,4,1997,Natalie Martinez,Jasonhaven
347,The life of Meghan Williams,5,1989,Heather Williams,South Kennethtown
348,I am not MediumSeaGreen,6,2006,Ashley Black,Port Kimberly
349,The Affair at Christopherberg,1,1998,Lauren Fields,Barkerfort
350,The Hope of little Emily Douglas,2,2011,Ashley Wood,Billyberg
351,The Beauty in Andersonland,3,2020,Bryan Bailey PhD,Olsonport
352,The life of Maria Murphy,4,1978,Mary Ortiz,South Matthew
353,I am not DarkSalmon,5,2009,Nicole Shaw,North Dominiqueside
354,The Affair at Andrewport,6,1994,Jason Heath,Patrickland
355,The Hope of little Daniel Meza,1,1992,Francisco Gutierrez,Jonathanville
356,The Beauty in Leeberg,2,1974,Victor Leonard,Port Angela
357,The Fall of Georgia,3,1975,John Calderon,Deniseburgh
358,The life of Ryan Garcia,4,2009,Brandon Hale,Lake Angela
359,I am not Yellow,5,2011,Thomas Anderson,New Thomastown
360,The Affair at East Marie,6,1995,Jamie Burke,Thompsontown
361,The Hope of little Rhonda Martin,1,1987,Tracy Johnson,Conwayborough
362,The Beauty in Williamsstad,2,2010,Austin Green,New Jessica
363,The life of Tracy Bishop,3,2000,Jennifer Martinez,Simpsonhaven
364,I am not RosyBrown,4,1977,Christina Murphy,Lake Colleentown
365,The Affair at Erikashire,5,1988,Patricia Harvey,Lake Seanville
366,The Hope of little Mrs. Diane Reyes,6,2016,Anthony Horn,Davischester
367,The Beauty in Burchborough,1,1994,Ashley Smith,New Kristineborough
368,The life of David Davidson,2,1992,Kimberly Thomas,Parkermouth
369,I am not Navy,3,2013,Rachel Peterson,Nealmouth
370,The Affair at Shannonhaven,4,2012,John Tate,Lindsayfurt
371,The Hope of little Jeffrey Potts,5,1985,Christopher Mcclure,West Melanie
372,The Beauty in Port Shannon,6,1996,Teresa Rowland,Johnsland
373,The life of Jennifer Sanders,1,2007,Charles Wright,Moniquehaven
374,The Affair at East Benjamin,2,1993,Kelly Webb,Wellsshire
375,The Hope of little Kaitlyn Guerra,3,1989,Brandy Miller,Stonebury
376,The Beauty in Westtown,4,1978,Jonathan Payne,Port Joshuabury
377,The life of Daniel Hernandez,5,1989,Elijah Short,Bautistashire
378,The Affair at North Maryfort,6,1994,Emily Lopez,Clarkmouth
379,The Hope of little Alexis Robertson,1,1992,Alexander Floyd,East Tiffany
380,The Beauty in Lake Douglas,2,1978,Michael Thompson,Johnsonborough
381,The life of Harry Duncan,3,1981,Karen Jones,East Monica
382,I am not GhostWhite,4,1998,Danielle Murphy,Stevensshire
383,The Affair at Zavalaview,5,1997,Catherine Carroll,Haleton
384,The Hope of little Heather Jones,6,1977,Kathy Chan,Hayesview
385,The Beauty in Lake Diane,1,1993,Julie Murray,New Dianemouth
386,The life of Nancy Cook,2,1982,Christopher Klein,South Heather
387,The Affair at Port Dennis,3,1994,Melanie Brown,Port Maryburgh
388,The Hope of little Terri Johnson,4,1995,Adrian Valdez,South Jasonbury
389,The Beauty in North Kylie,5,1989,Lindsay Jarvis,Gregoryberg
390,The life of Eric Sanders,6,1987,Peter Martinez,Lake Roy
391,I am not YellowGreen,1,1981,Mason Hodges,Wongport
392,The Affair at Joshuastad,2,2001,Amy Vasquez,North Cynthia
393,The Hope of little James Gonzales,3,2000,David Mitchell,Faulknerborough
394,The Beauty in Morganburgh,4,1974,Jessica Miller,Brookeberg
395,The Fall of New York,5,2005,Jacqueline Sullivan,Bentleystad
396,The life of Holly Salinas,6,2005,Madison Richardson,Lake Paulchester
397,I am not LightGreen,1,2011,Mary Martin,Port Christopherfurt
398,The Affair at North Markport,2,2019,Shawn Luna,North Daisystad
399,The Hope of little Lance Simmons,3,2019,Christopher Lopez,East Tom
400,The Beauty in Bellton,4,1978,James Hill,Anthonybury
401,The life of Heather Bolton,5,2003,Lindsey Rogers,Yvonnebury
402,I am not LightSalmon,6,2006,Michael Briggs,Shannonfort
403,The Affair at East Melindamouth,1,1995,Timothy Galvan,Lake Paulborough
